Source,Author,Title,Description,URL,Image URL,Published At,Content
Forbes,"Maggie McGrath, Forbes Staff, 
 Maggie McGrath, Forbes Staff
 https://www.forbes.com/sites/maggiemcgrath/",50 Over 50 Global: 2025,The Forbes' 50 Over 50 Global List 2025 highlights women 50 and over who are making an impact across a wide range of industries ranging from finance to fashion.,https://www.forbes.com/sites/maggiemcgrath/2025/01/23/50-over-50-global-2025/,"https://imageio.forbes.com/specials-images/imageserve/6792ba5eb2d6024a82b85e20/0x0.jpg?format=jpg&crop=1920,1080,x0,y0,safe&height=900&width=1600&fit=bounds",2025-01-23T23:00:06Z,"View the list: A-C
64 | Cofounder and Associate Scientific Director, CAPRISA | South Africa
Quarraisha Abdool Karim
An infectious diseases epidemiologist, Quarraisha Abdool Karim is one of the wor… [+35231 chars]"
Forbes,"Murtaza Ali, Forbes Councils Member, 
 Murtaza Ali, Forbes Councils Member
 https://www.forbes.com/councils/forbesfinancecouncil/people/murtazaali/",Betting On Disruption: Lessons On Defying Organizational Collapse,Here's how our organization defied collapse and turned itself around.,https://www.forbes.com/councils/forbesfinancecouncil/2025/01/27/betting-on-disruption-lessons-on-defying-organizational-collapse/,https://imageio.forbes.com/specials-images/imageserve/67936facea2e21dc940d2981/0x0.jpg?format=jpg&height=900&width=1600&fit=bounds,2025-01-27T13:15:00Z,"Murtaza Ali is President of JazzCash.
getty
Throughout business history, only a handful of companies have been able to successfully escape near-total collapse by transforming their business. The mo… [+6170 chars]"
Forbes,"Chaitra Vedullapalli, Forbes Councils Member, 
 Chaitra Vedullapalli, Forbes Councils Member
 https://www.forbes.com/councils/forbestechcouncil/people/chaitravedullapalli/",Leadership Dilemma: Influence Without Authority—How To Navigate This Challenge,Here's why influence without authority frequently fails.,https://www.forbes.com/councils/forbestechcouncil/2025/01/22/leadership-dilemma-influence-without-authority-how-to-navigate-this-challenge/,https://imageio.forbes.com/specials-images/imageserve/62ff94ed792fc2f8995f25e6/0x0.jpg?format=jpg&height=900&width=1600&fit=bounds,2025-01-22T12:45:00Z,"Cofounder of Women in Cloud. I influence brands and entrepreneurs to build thriving ecosystems through GTM strategies and partnerships.
getty
I believe influence often matters more than formal auth… [+4167 chars]"
Commonreader.co.uk,"Henry Oliver, Hollis Robbins (@Anecdotal)",Is Atlas Shrugged the New Vibe?,It's time to take Ayn Rand seriously.,https://www.commonreader.co.uk/p/is-atlas-shrugged-the-new-vibe,"https://substackcdn.com/image/fetch/w_1200,h_600,c_fill,f_jpg,q_auto:good,fl_progressive:steep,g_auto/https%3A%2F%2Fsubstack-post-media.s3.amazonaws.com%2Fpublic%2Fimages%2Fa96d43e4-bb5b-491a-a122-f7424d99fd79_918x645.jpeg",2025-01-18T15:16:37Z,"Atlas Shrugged seems to be everywhere today. Randian villains are in the news. Rand remains influential on the right, from the Reagan era to the modern libertarian movement. Perhaps most significantl… [+87173 chars]"
Addicted2success.com,Addicted2Success Editor,The ONE Thing Most Entrepreneurs Forget When Building Their Empire,"Balance entrepreneurship and health with these wellness strategies
The post The ONE Thing Most Entrepreneurs Forget When Building Their Empire appeared first on Addicted 2 Success.",https://addicted2success.com/entrepreneur-profile/the-one-thing-most-entrepreneurs-forget-when-building-their-empire/,https://addicted2success.com/wp-content/uploads/2025/01/The-ONE-Thing-Most-Entrepreneurs-Forget-When-Building-Their-Empire.png,2025-01-30T21:00:34Z,"Did you know that there is an extremely fine line between entrepreneurship and workaholism? Many business owners fail to recognize this line, striving to burn the midnight oil. 
In the short run, it… [+6824 chars]"
Forbes,"Javier Hasse, Senior Contributor, 
 Javier Hasse, Senior Contributor
 https://www.forbes.com/sites/javierhasse/","How Queen Zulu, Dr. Macias, Lost Her Home, Then Built A Cannabis Empire And Inspired Brittney Griner","The journey of Queen Zulu, Dr. Chanda Macias, from losing her home to pioneering a cannabis empire and inspiring Brittney Griner to embrace the power of the plant.",https://www.forbes.com/sites/javierhasse/2025/01/06/how-queen-zulu-dr-macias-lost-her-home-then-built-a-cannabis-empire-and-inspired-brittney-griner/,"https://imageio.forbes.com/specials-images/imageserve/67798c3b3cd2881d687dae8c/0x0.jpg?format=jpg&crop=1577,888,x0,y33,safe&height=900&width=1600&fit=bounds",2025-01-06T15:14:39Z,"Dr. Chanda Macias.
Courtesy of Women Grow
I believed in the plant, even when everyone told me I was throwing my life away, says Dr. Chanda Macias.
Her words land with the weight of a life defined … [+24641 chars]"
Vox,Rebecca Jennings,My descent into glow-up madness,"Sometime last spring, I decided to glow up. This is an extremely embarrassing thing to admit, or at least it should be. But this is America. If you’re not “glowing up,” which is to say, committing all of your time and money to the endless quest of self-improv…",https://www.vox.com/culture/393018/glow-up-challenges-75-hotter-tiktok,https://platform.vox.com/wp-content/uploads/sites/2/2025/01/Vox-Jan2025-SiobhanGallagher.jpg?quality=90&strip=all&crop=0%2C10.732984293194%2C100%2C78.534031413613&w=1200,2025-01-02T23:07:19Z,"Sometime last spring, I decided to glow up. This is an extremely embarrassing thing to admit, or at least it should be. But this is America. If youre not glowing up, which is to say, committing all o… [+18070 chars]"
Forbes,"Geri Stengel, Contributor, 
 Geri Stengel, Contributor
 https://www.forbes.com/sites/geristengel/",Women’s Health: A New Frontier For VC Investment Report Finds,"Investing in women’s health can drive innovation, improve health outcomes for women globally, and unlock significant financial returns and economic growth.",https://www.forbes.com/sites/geristengel/2025/01/14/womens-health-a-new-frontier-for-vc-investment-report-finds/,https://imageio.forbes.com/specials-images/imageserve/6782a3e5095b18d97172bc84/0x0.jpg?format=jpg&height=900&width=1600&fit=bounds,2025-01-14T08:00:00Z,"Women's healthcare is increasingly tailored to their life stage and medical needs.
getty
""The WHAM Report: The Business Case for Accelerating Womens Health Investment,"" released today at the J.P. M… [+8195 chars]"
Hubspot.com,fneedle@hubspot.com (Flori Needle),Entrepreneurs Are Struggling With Mental Health — Here’s How They Manage Their Stress,"Entrepreneurs are more likely to self-report having mental health struggles, which makes sense—starting a business from scratch can be risky, exhilarating, and exhausting, often all at once.",https://blog.hubspot.com/sales/entrepreneurs-are-struggling-with-mental-health-but-wheres-the-support#article,https://www.hubspot.com/hubfs/entrepreneur%20mental%20health.webp,2025-01-09T12:00:00Z,"Entrepreneurs are more likely to self-report having mental health struggles, which makes sensestarting a business from scratch can be risky, exhilarating, and exhausting, often all at once.
Whats mo… [+12171 chars]"
Forbes,"Pete Wilkins, Contributor, 
 Pete Wilkins, Contributor
 https://www.forbes.com/sites/peterandrewwilkins/",How Simple Mills' $795 Million Deal Will Ignite Chicago's Startup Scene In 2025,Simple Mills' $795 acquisition by Flowers Foods is significant for the startup community in Chicago for several important reasons.,https://www.forbes.com/sites/peterandrewwilkins/2025/01/30/how-simple-mills-795-million-deal-will-ignite-chicagos-startup-scene-in-2025/,"https://imageio.forbes.com/specials-images/imageserve/679b89bd97f23707c1cecb65/0x0.jpg?format=jpg&crop=3536,1988,x0,y182,safe&height=900&width=1600&fit=bounds",2025-01-30T14:44:18Z,"Simple Mills' Founder and CEO, Katlin Smith
Simple Mills
A remarkable startup narrative is unfolding at the start of 2025, one that resonates far beyond the confines of the city: Simple Mills, a pi… [+5475 chars]"
Yahoo Entertainment,WXYZ-Detroit Videos,"Femology, a Detroit organization empowering female entrepreneurs, launches at NewLab","Meagan Ward is a powerhouse and has made it her mission to put women at the forefront of business. She does so through her organization, Femology.",https://consent.yahoo.com/v2/collectConsent?sessionId=1_cc-session_cfd45be8-7b37-4ba7-bf3a-b96e301e7544,,2025-01-23T22:47:44Z,"If you click 'Accept all', we and our partners, including 239 who are part of the IAB Transparency &amp; Consent Framework, will also store and/or access information on a device (in other words, use … [+703 chars]"
Forbes,"Gemma Allen, Contributor, 
 Gemma Allen, Contributor
 https://www.forbes.com/sites/gemmaallen/",Mark Zuckerberg’s ‘Masculine Energy’ Is Tech’s Power Play Laid Bare,"Mark Zuckerberg's 'masculine energy'  coincides with tech's cultural shift: DEI rollbacks, AI advancement, and the return of Trump expose Silicon Valley's power dynamics.",https://www.forbes.com/sites/gemmaallen/2025/01/19/mark-zuckerbergs-masculine-energy-is-techs-power-play-laid-bare/,https://imageio.forbes.com/specials-images/imageserve/67887c7b4defd2eebf52b320/0x0.jpg?format=jpg&height=900&width=1600&fit=bounds,2025-01-19T23:30:23Z,"ANAHEIM, CALIFORNIA - FEBRUARY 17: Alexander Volkanovski of Australia prepares to face Ilia Topuria ... [+] in their featherweight title fight as Mark Zuckerberg looks on during UFC 298 at Honda Cent… [+8434 chars]"
IndieWire,David Ehrlich,‘Cutting Through Rocks’ Review: A Sharp Documentary Profiles a Motorcycle-Loving Woman Who Takes on the Patriarchy in Rural Iran,"Sundance: Sara Khaki and Mohammadreza Eyni’s precisely lensed film follows Sara Shahverdi, the first councilwoman in the history of her remote village.",https://www.indiewire.com/criticism/movies/cutting-through-rocks-review-movie-review-sara-shahverdi-1235089757/,https://www.indiewire.com/wp-content/uploads/2025/01/i3100iwe2snvwhlrzyCutting_Through_Rocks_Still3.jpeg?w=650,2025-01-29T15:45:00Z,"Sara Khaki and Mohammadreza Eyni’s precisely lensed “Cutting Through Rocks“ is a deftly shaped work of cinematic nonfiction that opens with a literal bang, as we cut from a black screen to a middle-a… [+6644 chars]"
Forbes,"Kimi Evans, Forbes Councils Member, 
 Kimi Evans, Forbes Councils Member
 https://www.forbes.com/councils/forbesbusinesscouncil/people/kimievans/","For Loyalty And Success, Center Your Business In Community","Creating a community-centered business takes effort, but it’s worth it.",https://www.forbes.com/councils/forbesbusinesscouncil/2025/01/24/for-loyalty-and-success-center-your-business-in-community/,https://imageio.forbes.com/specials-images/imageserve/5f2dc22afaff939159573985/0x0.jpg?format=jpg&height=900&width=1600&fit=bounds,2025-01-24T14:45:00Z,"Kimi Evans is a meteorologist and former TV news personality in L.A., San Diego, and Hawaii. Owner of Honor Pilates.
getty
Community is a must in our everyday lives, but did you know it also serves… [+4477 chars]"
Forbes,"Diane Wang, Forbes Books Author, 
 Diane Wang, Forbes Books Author
 https://www.forbes.com/sites/forbesbooksauthors/people/dianewang/","Bored or Burned Out? Remember, You Are an Experiment",Ask yourself what steps you to take to pursue your dreams. Life is about growth. Growth is about risk. It is about knowing you are taking a chance and doing it anyway.,https://www.forbes.com/sites/forbesbooksauthors/2025/01/28/bored-or-burned-out-remember-you-are-an-experiment/,https://imageio.forbes.com/specials-images/imageserve/6799224d4daa38b40db6f01b/0x0.jpg?format=jpg&height=900&width=1600&fit=bounds,2025-01-28T18:31:58Z,"Freedom comes from getting out of a rut.
getty
Regardless of where you are in your life and career, what do you see when you look back? A clear path? If youre like most of us, maybe not.
Maybe you… [+3763 chars]"
Venturesquare.net,오효진,"한국여성벤처협회, ‘선배기업 브릿지 네트워킹 데이’ 개최","한국여성벤처협회가 ‘2024년 예비창업패키지 여성특화분야 선배기업 브릿지 네트워킹 데이’를 개최, 창업자와 선배 기업인들이 경험을 공유하고 해결책을 모색하는 기회를 제공했다.
The post 한국여성벤처협회, ‘선배기업 브릿지 네트워킹 데이’ 개최 appeared first on 벤처스퀘어.",https://www.venturesquare.net/954996,https://www.venturesquare.net/wp-content/uploads/2025/01/117.jpg,2025-01-20T06:18:57Z,", . . 50 . . . , 1:1 . , . , . . , . , .Korea Women's Venture Association holds 'Senior Company Bridge Networking Day' 
The Korea Women's Venture Association (Chairperson Mi-ok Yoon) announced on th… [+5447 chars]"
Phys.Org,Tinashe Sithole,Africa without borders could help the continent prosper. What's getting in the way?,"The vision of a ""borderless Africa"" is one of unity and shared prosperity for the continent. It is rooted in the ideals of the pan-Africanist movement.",https://phys.org/news/2025-01-africa-borders-continent-prosper.html,https://scx2.b-cdn.net/gfx/news/hires/2015/africa.jpg,2025-01-22T18:20:08Z,"The vision of a ""borderless Africa"" is one of unity and shared prosperity for the continent. It is rooted in the ideals of the pan-Africanist movement.
There are contradictions, however, between tho… [+7698 chars]"
BusinessLine,GP Hinduja,A Budget for sabka vikas,"The reforms are aimed at fostering inclusive growth and economic resilience across various sectors, with particular emphasis on the middle class, farmers and women entrepreneurs.",https://www.thehindubusinessline.com/opinion/a-budget-for-sabka-vikas/article69170230.ece,https://bl-i.thgim.com/public/incoming/34hyv8/article69170227.ece/alternates/LANDSCAPE_1200/PTI02_01_2025_000320A.jpg,2025-02-01T18:00:13Z,"With fiscal prudence at the core, a budget bonanza for the middle class reinforces Amritkaal.
The reforms are aimed at fostering inclusive growth and economic resilience across various sectors, with… [+2593 chars]"
Venturesquare.net,강진희,"한국여성벤처협회, ‘여성벤처&스타트업 커넥트데이’ 종료","한국여성벤처협회는 '여성벤처&스타트업 커넥트데이' 행사를 개최했다고 밝혔다.
The post 한국여성벤처협회, ‘여성벤처&스타트업 커넥트데이’ 종료 appeared first on 벤처스퀘어.",https://www.venturesquare.net/954856,https://www.venturesquare.net/wp-content/uploads/2025/01/ksdhgjdf.jpg,2025-01-20T06:17:38Z,"‘&amp; ’ . , .
 1 IR , 13 . , . BM , , , · 1:1 .
2 . 2025 , . , .
, , , , . , , .
 () .
Korea Women's Venture Association, 'Women's Venture &amp; Startup Connect Day' Ends 
The Korea Women Vent… [+4509 chars]"
Nextcity.org,Ilana Preuss (Op-Ed),A Pittsburgh Sewing Network Shows How Entrepreneurs Can Thrive in Place,"(Images courtesy Knotzland)


 






This piece is part of a new series on women entrepreneurs addressing community and economic development needs through small-scale manufacturing.

Despite no formal sewing training and few successful entrepreneurship exam…",https://nextcity.org/urbanist-news/pittsburgh-sewing-network-entrepreneur-knotzland-nisha-blackwell,https://nextcity.org/images/daily/_resized/nisha_blackwell_knotzland.jpg,2025-01-27T11:00:00Z,"This piece is part of a new series on women entrepreneurs addressing community and economic development needs through small-scale manufacturing.
Despite no formal sewing training and few successful … [+6243 chars]"
Forbes,"Ann Abel, Senior Contributor, 
 Ann Abel, Senior Contributor
 https://www.forbes.com/sites/annabel/",This Travel Startup Is Bringing Adventure Racing To New Audiences,"Founded by adventure racers, Terra Venture gives everyday people the transformative experience of leaving their comfort zone—without training like an elite athlete",https://www.forbes.com/sites/annabel/2025/01/30/this-travel-startup-is-bringing-adventure-racing-to-new-audiences/,https://imageio.forbes.com/specials-images/imageserve/679ba0f835d5d7112323bf05/0x0.jpg?format=jpg&height=900&width=1600&fit=bounds,2025-01-30T16:06:39Z,"Cycling through the Colombian wilderness
Courtesy of Terra Venture
You fit like a years worth of emotionhighs and lowsinto one week, says adventure racer Rob Preston about his chosen sport. Its som… [+6101 chars]"
Bitsaboutmoney.com,Patrick McKenzie (patio11),A Very Chicago Gamble,Chicago and Bally's have teamed up in an investment offering.,https://www.bitsaboutmoney.com/archive/chicago-casino-investment-offering/,https://www.bitsaboutmoney.com/content/images/2025/01/chicago-casino-capital-raise-dalle.jpg,2025-01-24T19:56:31Z,"This column doesnt offer investment advice, as I am not a registered investment advisor. This is not merely a mandatory disclaimer; this is a warning. We will discuss some specific securities below t… [+36373 chars]"
Iasexamportal.com,trainee5,(GIST OF KURUKSHETRA) COMPREHENSIVE ECOSYSTEM FOR RURAL WOMEN ENTREPRENEURSHIP,,https://iasexamportal.com/the-gist/kurukshetra-comprehensive-ecosystem-for-rural-women-entrepreneurship,,2025-01-02T13:59:14Z,"(GIST OF KURUKSHETRA) COMPREHENSIVE ECOSYSTEM FOR RURAL WOMEN ENTREPRENEURSHIP
(DECEMBER-2024)
COMPREHENSIVE ECOSYSTEM FOR RURAL WOMEN ENTREPRENEURSHIP
Introduction
India, recognized as one of th… [+5682 chars]"
Forbes,"Melissa Houston, Contributor, 
 Melissa Houston, Contributor
 https://www.forbes.com/sites/melissahouston/",Money Mindset Shifts For Small Business Owners,A healthy money mindset isn’t just about thinking positively. It is about having a positive relationship with money so that you can confidently make financial decisions.,https://www.forbes.com/sites/melissahouston/2025/01/22/money-mindset-shifts-for-small-business-owners/,https://imageio.forbes.com/specials-images/imageserve/6415d28bca904a8fd5990532/0x0.jpg?format=jpg&height=900&width=1600&fit=bounds,2025-01-22T11:00:00Z,"Money Mindset Shifts For Small Business Owners
getty
Your business will only grow as much as your mindset allows. This is what separates thriving business owners from ones who are constantly strugg… [+4186 chars]"
Thedailymash.co.uk,The Daily Mash,Vape shops selling illegal kazoos,,https://www.thedailymash.co.uk/news/health/vape-shops-selling-illegal-kazoos-20250122254179,https://cdn.thedailymash.co.uk/wp-content/uploads/20250122151533/kazoo-2000x1124-3.jpg,2025-01-22T16:02:01Z,"By Abigail Pennson, our reasonable, plain-speaking middle-class columnist who loves Britain so much she wishes it was America
THEY work all hours. Theyre entrepreneurs. And nothing matters more to t… [+1514 chars]"
Forbes,"Danielle Chemtob, Forbes Staff, 
 Danielle Chemtob, Forbes Staff
 https://www.forbes.com/sites/daniellechemtob/",Forbes Daily: Supreme Court Could Rule On TikTok Case As Ban Looms,"Friday's Forbes Daily covers a billionaire's plans for a legendary Las Vegas property, what's next for the TikTok ban, Musk and Bezos apparently make amends and more",https://www.forbes.com/sites/daniellechemtob/2025/01/17/forbes-daily-supreme-court-could-rule-on-tiktok-case-as-ban-looms/,"https://imageio.forbes.com/specials-images/imageserve/678a549204d72d4e5614c05b/0x0.jpg?format=jpg&crop=4759,2676,x0,y237,safe&height=900&width=1600&fit=bounds",2025-01-17T13:03:49Z,"This is a published version of the Forbes Daily newsletter, you can sign-up to get Forbes Daily in your inbox here.
Good morning,
The FDA has finally greenlit the popular nicotine pouches that are … [+8166 chars]"
BusinessLine,K Ram Kumar,Budget proposals to give a fillip to Bank credit growth,"Sitharaman said a new scheme for 5 lakh first-time entrepreneurs, including women, SCs and STs, will be launched to provide term loans up to ₹2 crore during the next 5 years",https://www.thehindubusinessline.com/money-and-banking/budget-proposals-to-give-a-fillip-to-bank-credit-growth/article69168702.ece,https://bl-i.thgim.com/public/incoming/b1v1in/article69168800.ece/alternates/LANDSCAPE_1200/419158515.jpg,2025-02-01T13:20:10Z,"Bank credit could get a fillip over the next few years as the Union Budget for FY25 has proposed a host of measures, including increase in Kisan Credit Card (KCC) limit to .5 lakh (from 3 lakh), intr… [+2660 chars]"
Atlas Obscura,Matt Broomfield,The Twisted History Behind Medieval Torture Museums,"Tourists trickle down into the bowels of Belgrade’s monumental fortress, attracted by banners promising a ""MEDIEVAL TORTURE MUSEUM."" A $5 entrance fee secures access to three dusty, gloomy rooms, tucked away in the battlements alongside a range of other money…",https://www.atlasobscura.com/articles/medieval-torture-museums,https://img.atlasobscura.com/4dhSeaTrren3FuyHCWK2G_pJscUnHtTAp2Wlz9E4WDI/rt:fit/w:600/q:81/sm:1/scp:1/ar:1/aHR0cHM6Ly9hdGxh/cy1kZXYuczMuYW1h/em9uYXdzLmNvbS91/cGxvYWRzL2Fzc2V0/cy9iMzc0MzRjMC01/NjRjLTRiOWItYWVj/Ni1jOTFjNDVmOWIx/MDQ4YzdlMWJmN2Q2/YTc0NTRjZDlfR2V0/dHlJbWFnZXMtOTU3/NDgyMjgyLmpwZw.jpg,2025-01-16T21:45:00Z,"Tourists trickle down into the bowels of Belgrade’s monumental fortress, attracted by banners promising a “MEDIEVAL TORTURE MUSEUM.” A $5 entrance fee secures access to three dusty, gloomy rooms, tuc… [+8385 chars]"
Forbes,"Pamela N. Danziger, Senior Contributor, 
 Pamela N. Danziger, Senior Contributor
 https://www.forbes.com/sites/pamdanziger/",Fabletics Is More Than Just A Celebrity Athleisure Brand,"Activewear Fabletics has proven it has staying power, growing to $850 million in sales, 100+ stores and expanding from women's athleisure to men's activewear and scrubs.",https://www.forbes.com/sites/pamdanziger/2025/01/09/fabletics-is-more-than-just-a-celebrity-athleisure-brand/,https://imageio.forbes.com/specials-images/imageserve/677ff39795baadc905dd9420/0x0.jpg?format=jpg&height=900&width=1600&fit=bounds,2025-01-09T17:15:43Z,"TORRANCE, CA - SEPTEMBER 26: Kate Hudson visits Fabletics at Del Amo Fashion Center on September ... [+] 26, 2017 in Torrance, California. (Photo by Stefanie Keenan/Getty Images for Fabletics)
getty… [+10274 chars]"
Inman,Craig C. Rowe,Startup advisory firm Equity Angels delivers upbeat 2024 impact report,"Founded by Kenya Burrell-VanWormer and Katherine Winston, the advisory group completed the formation of a mentorship team and raised $3 million in its first year in operation, according to the report.",https://www.inman.com/2025/01/28/startup-advisory-firm-equity-angels-delivers-upbeat-2024-impact-report/,https://assets.inman.com/wp-content/uploads/2025/01/EquityAngels_ICNY24-1024x683.jpg,2025-01-28T14:56:23Z,"Turn up the volume on real estate success at Inman On Tour: Nashville! Connect with industry trailblazers and top-tier speakers to gain powerful insights, cutting-edge strategies, and invaluable conn… [+3015 chars]"
Forbes,"Alexandra York, Forbes Staff, 
 Alexandra York, Forbes Staff
 https://www.forbes.com/sites/alexyork/","Calling The Biggest And Brightest Young Founders, CEOs And Changemakers In Europe—30 Under 30 Nominations Are Now Open","Forbes is on the hunt for the next class of European changemakers. If you or someone you know belongs in the cohort of leaders—ranging from Malala Yousafzai to Marco Cancellieri, apply today.",https://www.forbes.com/sites/alexyork/2025/01/10/calling-the-biggest-and-brightest-young-founders-ceos-and-changemakers-in-europe-30-under-30-nominations-are-now-open/,https://imageio.forbes.com/specials-images/imageserve/6780280b1ee0e50525643d2a/0x0.jpg?format=jpg&height=900&width=1600&fit=bounds,2025-01-10T13:00:00Z,"Think this is nice? Its a version of the weekly Under 30 newsletter and would be even better in your inbox. 
From left: Vladimir Danila, PinkPantheress, Madeline Argy, Hendrik Kramer.
Photography b… [+12062 chars]"
CBC News,,She's helping women break mental barriers about money — and invest in themselves,"After developing a business matchmaking platform to connect women entrepreneurs with funding, Tayssa Waldron realized that the financial barriers women are often rooted in mental and emotional factors. She’s now committed to helping women build a healthier re…",https://www.cbc.ca/news/canada/montreal/tayssa-waldron-black-changemakers-1.7428790,https://i.cbc.ca/1.7213459.1716515476!/fileImage/httpImage/image.JPG_gen/derivatives/16x9_1180/tayssa-waldron-2.JPG?im=Resize%3D620,2025-01-11T09:00:00Z,"CBC Quebec is highlighting people from the province's Black communities who are giving back, inspiring others and helping to shape our future. These are the 2024 Black Changemakers.
It was 2020, the… [+8558 chars]"
The Punch,Oluwakemi Abimbola,Tony Elumelu Foundation opens entries for 2025 entrepreneurship programmes,The Tony Elumelu Foundation has announced the opening of its 2025 Entrepreneurship Programmes applications. This was contained in a statement made available to The PUNCH on Monday. The Tony Elumelu Foundation is a leading philanthropy that empowers a new gene…,https://punchng.com/tony-elumelu-foundation-opens-entries-for-2025-entrepreneurship-programmes/,https://cdn.punchng.com/wp-content/uploads/2023/09/20010152/Tony-Elumelu-Foundation.jpg,2025-01-06T23:28:03Z,"The Tony Elumelu Foundation has announced the opening of its 2025 Entrepreneurship Programmes applications.
This was contained in a statement made available to The PUNCH on Monday.
The Tony Elumelu… [+2388 chars]"
