Source,Author,Title,Description,URL,Image URL,Published At,Content
Venturesquare.net,오효진,"의식주의, 2024 서울어워드 우수상품 수상","의식주의의 '텐셀 모달 머드 요실금 팬티'가 2024 서울어워드 우수상품으로 선정되어 국내외 판로 개척과 홍보 지원을 받는다.
The post 의식주의, 2024 서울어워드 우수상품 수상 appeared first on 벤처스퀘어.",https://www.venturesquare.net/954718,https://www.venturesquare.net/wp-content/uploads/2025/01/seoul.jpg,2025-01-17T01:57:02Z,"(SBA) , . ( , : 10-2023-0160317) , .‘’ 40% 50 30% , ‘ 100’ . , . , 2 3 2 16 2 .Ritualism, 2024 Seoul Award Excellence Product Winner 
Climate tech startup 'Siksikju' (CEO Tae-i Yoon) announced that … [+4206 chars]"
BusinessLine,Our Bureau,"Coffee Board, NLM-Karnataka sign MoU to train women in entrepreneurship","Coffee Board of India and National Livelihood Mission empower women through coffee entrepreneurship, promoting gender equality and economic growth.",https://www.thehindubusinessline.com/economy/agri-business/coffee-board-nlm-karnataka-sign-mou-to-train-women-in-entrepreneurship/article69127367.ece,https://bl-i.thgim.com/public/incoming/xmvl86/article69127365.ece/alternates/LANDSCAPE_1200/IMG-20250122-WA0018.jpg,2025-01-22T12:21:34Z,The Coffee Board of India and the National Livelihood Mission-Karnataka have signed a memorandum of understanding (MoU) to empower about one lakh women members of the NLM self help groups across the … [+2121 chars]
Venturesquare.net,문지형 스타업 기자단 1기 기자,"실리콘밸리의 문을 여는 세 가지 열쇠, “자금·인재·문화”","“자금·인재·시장, 미국식 게임의 법칙을 배워라” 샌드버드·Constellation·MarqVision 창업자들이 전하는 현지화 전략 “돈보다 임팩트… 투자자·직원·고객 모두에게 ‘무슨 이익이 있나’ 답하...
The post 실리콘밸리의 문을 여는 세 가지 열쇠, “자금·인재·문화” appeared first on 벤처스퀘어.",https://www.venturesquare.net/953892,https://www.venturesquare.net/wp-content/uploads/2025/01/1736563425179-4-e1736729277506.jpg,2025-01-13T00:49:28Z,"“ 60 . 10 .” 10, UKF 2025 . 3 2 70 API , · AI Constellation , AI MarqVision .“ .”. “ 20~30 VC . VC , .” 2 2 .“ IP . . .” (Mark Lee) 4,100 . “ , VC . .”Constellation . “ 15 . 15 . 2 60% , .” “ 2% VC ”… [+5343 chars]"
Livemint,Riya R Alex,Top 6 government loans to support women entrepreneurs in 2025,"The Indian government has introduced several loan schemes to empower women entrepreneurs, including Annapurna, Mudra, Stand Up India, Stree Shakti, Cent Kalyani, and Udyogini. These initiatives provide financial resources to support women's participation in t…",https://www.livemint.com/money/personal-finance/top-6-government-loans-to-support-women-entrepreneurs-in-2025-11737559557526.html,https://www.livemint.com/lm-img/img/2025/01/22/1600x900/PTI01-15-2024-000028A-0_1705308007914_1737559833409.jpg,2025-01-27T06:00:17Z,"In the current financial landscape, women entrepreneurs are becoming a strong and emerging force in India. To promote and support the participation of women in the economy, the government has introdu… [+2865 chars]"
BusinessLine,BL Bengaluru Bureau,"Economic Survey: Startup India Seed Fund has approved ₹227 cr in funding to 1,278 women entrepreneurs","Government schemes support women-led start-ups with funding, loans, and mentorship, empowering entrepreneurs to start and scale businesses.",https://www.thehindubusinessline.com/economy/economic-survey-startup-india-seed-fund-has-approved-227-cr-in-funding-to-1278-women-entrepreneurs/article69164685.ece,https://bl-i.thgim.com/public/incoming/i9s887/article68577150.ece/alternates/LANDSCAPE_1200/IMG_bl08_Happy_women_2_1_CSAV8NHR.jpg,2025-02-01T01:42:49Z,"The Startup India Seed Fund Scheme (SISFS) has approved 227.12 crore in funding for as many as 1,278 women-led start-ups since inception in April 2021, according to the governments pre-budget Economi… [+1529 chars]"
Skift,Sean O'Neill,Hotel CEOs Navigate Trump's DEI Crackdown,"The Trump Administration says many DEI initiatives are illegal, and hotel groups are among the many companies evaluating their efforts. Both the Oval Office and C-suites are leaving the details on changes for a later time. -Sean O'Neill",http://skift.com/2025/01/30/hotel-ceos-navigate-trumps-dei-crackdown/,https://skift.com/wp-content/uploads/2025/01/ceo-panel-alis-conference.jpg,2025-01-30T15:44:53Z,"As U.S. businesses evaluate their diversity initiatives in light of scrutiny from the Trump Administration, CEOs of the largest hotel groups positioned the overall concept of diversity as essential t… [+4405 chars]"
The Times of India,TIMESOFINDIA.COM,Dehradun hosts inaugural Devbhumi Udyam conclave to empower women entrepreneurs,"The inaugural Devbhumi Udyam conclave, organised by USRLM with MSC, aims to support women entrepreneurs in rural Uttarakhand by addressing their business scaling challenges and financial access. Key insights were provided by notable institutions, highlighting…",https://timesofindia.indiatimes.com/business/india-business/dehradun-hosts-inaugural-devbhumi-udyam-conclave-to-empower-women-entrepreneurs/articleshow/117305262.cms,"https://static.toiimg.com/thumb/msid-117305201,width-1070,height-580,imgsize-401656,resizemode-75,overlay-toi_sw,pt-32,y_pad-40/photo.jpg",2025-01-16T14:38:39Z,"CBSE Board Exam Prep 2025: 9 Proven Tips to Study Smarter,NotHarder"
BusinessLine,Sudhir  Panikassery,Startup India has fuelled entrepreneurial spirit,"The initiative has simplified compliance processes, reduced bureaucratic hurdles, and empowered entrepreneurs to focus on their innovations rather than paperwork",https://www.thehindubusinessline.com/opinion/startup-india-has-fuelled-entrepreneurial-spirit/article69096759.ece,https://bl-i.thgim.com/public/incoming/9wu453/article69096763.ece/alternates/LANDSCAPE_1200/PO07_BS_Strategy_stock.jpg,2025-01-13T15:28:31Z,"India has emerged as a global hub for innovation and entrepreneurship, thanks largely to the governments Startup India initiative. Launched in 2016, Startup India has been a cornerstone in reshaping … [+3385 chars]"
Ritholtz.com,Barry Ritholtz,"Transcript: Sunaina Sinha, Global Head of Private Capital with Raymond James","The transcript from this week’s, MiB: Sunaina Sinha, Global Head of Private Capital with Raymond James, is below. You can stream and download our full conversation, including any podcast extras, on Apple Podcasts, Spotify, YouTube, and Bloomberg. All of our e…",https://ritholtz.com/2025/01/transcript-sunaina-sinha/,https://ritholtz.com/wp-content/uploads/2023/02/Mib-tile.png,2025-01-07T13:30:55Z,"The transcript from this weeks, MiB: Sunaina Sinha, Global Head of Private Capital with Raymond James, is below.
You can stream and download our full conversation, including any podcast extras, on A… [+66073 chars]"
BusinessLine,BL Bengaluru Bureau,Odisha signs MoU with 11 firms for horticulture exports,"About 10,000 participants, including farmers, women-led self-help groups (SHGs), Farmer Producer Organizations (FPOs), exporters, students, and agri-entrepreneurs participated atin Krushi Odisha 2025",https://www.thehindubusinessline.com/economy/agri-business/odisha-signs-mou-with-11-firms-for-horticulture-exports/article69072145.ece,https://bl-i.thgim.com/public/incoming/gns612/article69072157.ece/alternates/LANDSCAPE_1200/Directorate%20of%20Horticulture%20Government%20of%20Odisha%20supported%20by%20Palladium%20Signs%2011%20MoUs%20with%20Private%20Sector%20Companies%20-%203.jpg,2025-01-07T11:45:20Z,"The Directorate of Horticulture, Odisha in collaboration with Palladium Consulting India Pvt Ltd has signed 11 memorandum of understanding (MoUs) with private sector exporters at the Krushi Odisha 20… [+1474 chars]"
Project Syndicate,Ricardo Hausmann,"Ricardo Hausmann on immigration, climate finance, economic complexity, and more","Ricardo Hausmann urges the US to issue more H1-B visas, argues that Europe must become a military superpower in its own right, applies the “growth diagnostics” framework to Venezuela, and more.",https://www.project-syndicate.org/onpoint/interview-with-ricardo-hausmann-immigration-climate-finance-economic-complexity-2025-01,https://webapi.project-syndicate.org/library/c4b7c96fdfa342c8a1f86c74024db404.2-1-super.1.jpg,2025-01-14T13:58:12Z,"This week in Say More, PS talks with Ricardo Hausmann, a professor at Harvard Kennedy School and Director of the Harvard Growth Lab.Project Syndicate: Two years ago, you and Dany Bahar warned that th… [+7570 chars]"
BusinessLine,BL Mumbai Bureau,"SBI launches special training programme for 5,200 women",SBI launches special training program for rural women with diverse modules to promote self-reliance and economic independence.,https://www.thehindubusinessline.com/money-and-banking/sbi-launches-special-training-programme-for-5200-women/article69151954.ece,https://bl-i.thgim.com/public/incoming/g10by7/article69153376.ece/alternates/LANDSCAPE_1200/IMG_FILE_PHOTO__FILE_PHO_2_1_07D7TC4U.jpg,2025-01-29T04:07:14Z,"State Bank of India (SBI) has launched a special training programme tailored exclusively for women across its 153 Rural Self Employment Training Institutes (RSETIs).
 This programme, which was inaug… [+1142 chars]"
The Times of India,TNN,"For women empowerment, female participation in MSMEs must increase: Godinho","Panaji: Of the 66,000 MSMEs registered in Goa, only 1,600 are led by women entrepreneurs, said industries minister, Mauvin Godinho, on Friday.",https://timesofindia.indiatimes.com/city/goa/for-women-empowerment-female-participation-in-msmes-must-increase-godinho/articleshow/117796621.cms,"https://static.toiimg.com/thumb/msid-117796605,width-1070,height-580,imgsize-27146,resizemode-75,overlay-toi_sw,pt-32,y_pad-40/photo.jpg",2025-01-31T15:35:54Z,10 most beautiful sea animals
Biztoc.com,theglobeandmail.com,Tips for entrepreneurs experiencing post-holiday anxiety,"Ask Women and Work
Question: I’m a small-business owner coming off a hectic holiday period when business was great, almost too busy to handle! But now, I’m anxious and filled with dread about the slow months to come. How can I better cope with this ‘feast-or-…",https://biztoc.com/x/3a1b4324e141314f,https://biztoc.com/cdn/3a1b4324e141314f_s.webp,2025-01-15T13:06:10Z,"Ask Women and WorkQuestion: Im a small-business owner coming off a hectic holiday period when business was great, almost too busy to handle! But now, Im anxious and filled with dread about the slow m… [+133 chars]"
BusinessLine,Tuhin A  Sinha,India’s start-up ecosystem as a catalyst for growth,Start-ups are not only transforming India’s economic landscape but also contributing to gender inclusivity,https://www.thehindubusinessline.com/opinion/indias-start-up-ecosystem-as-a-catalyst-for-growth/article69054801.ece,https://bl-i.thgim.com/public/incoming/mbgexs/article69054805.ece/alternates/LANDSCAPE_1200/PO30_Trading.jpg,2025-01-02T15:32:27Z,"The Centre launched the Startup India initiative on January 16, 2016. To support start-ups at various stages of their lifecycle, the government has introduced flagship schemes such as:
Fund of Funds… [+2727 chars]"
Livemint,mint,The budget gives MSMEs a big boost to help make India self-reliant,"It lowers financing and other hurdles to help make micro, small and medium enterprises the ‘second engine’ of India’s growth story",https://www.livemint.com/opinion/online-views/budget-speech-2025-msme-credit-guarantee-gig-workers-dhan-income-tax-slab-8th-consecutive-budget-nirmala-sitharaman-11738246143567.html,https://www.livemint.com/lm-img/img/2025/02/01/1600x900/3-0-58338572-edit-DSC-4346-0_1679807336215_1738408845591.jpg,2025-02-01T11:23:20Z,"Micro, small and medium enterprises (MSMEs) are the backbone of Indias economic structure, contributing nearly 30% to gross domestic product (GDP), 45% to exports and generating employment for over 7… [+5177 chars]"
Biztoc.com,fortune.com,There’s a $32 trillion reason to bet big on women entrepreneurs as your 2025 investment resolution,"Female entrepreneurs, long underserved by VCs, often recognize opportunities that have been hiding in plain sight. Read More",https://biztoc.com/x/82b07c26248201a0,https://biztoc.com/cdn/82b07c26248201a0_s.webp,2025-01-08T12:53:54Z,"Female entrepreneurs, long underserved by VCs, often recognize opportunities that have been hiding in plain sight. Read More
This story appeared on fortune.com, 2025-01-08 12:48:00."
Livemint,mint,A few benefits for startups but no real dismantling of complex regulatory landscape,The Union Budget 2025-26 has some sops for the startup ecosystem in relation to funding and extending the period for some tax benefits.,https://www.livemint.com/opinion/budget-2025-startups-regulatory-internet-aifs-digitization-ai-women-entrepreneurs-income-tax-act-e-shram-portal-11738412090307.html,https://www.livemint.com/lm-img/img/2025/02/01/1600x900/startup_1738412704482_1738412704720.jpg,2025-02-02T00:00:19Z,"India has the third largest startup ecosystem in the world, which is expected to witness year-on-year growth of 12%-15%. Two or three tech startups are born everyday. The enterprising spirit of India… [+3609 chars]"
The Times of India,ET Online,"Union Budget 2025: New Rs 2 crore loan scheme for women & SC/ST entrepreneurs, says FM Nirmala Sitharaman","The Union Budget 2025-26, presented by Finance Minister Nirmala Sitharaman, outlines key measures aimed at empowering women, particularly in entrepreneurship. Key initiatives include increased credit access, loans for first-time women entrepreneurs, and healt…",https://economictimes.indiatimes.com/news/economy/policy/union-budget-2025-new-2-crore-loan-scheme-for-women-sc/st-entrepreneurs-says-fm-nirmala-sitharaman/articleshow/117818252.cms,"https://img.etimg.com/thumb/msid-117819154,width-1200,height-630,imgsize-1927559,overlay-economictimes/articleshow.jpg",2025-02-01T06:16:30Z,"Union Budget 2025: On Saturday, Finance Minister Nirmala Sitharaman presented India's Union Budget for 2025-26, marking her record eighth consecutive budget. Against the backdrop of an economic slowd… [+4449 chars]"
Naturalnews.com,News Editors,Progressive worldviews are based upon a collection of myths,Michael Huemer’s Progressive Myths is a powerful critique of contemporary progressive dogmas that eviscerates popular cliches with clinical precision. The University of Colorado philosophy professor probes a variety of explosive topics—ranging from racial and…,https://www.naturalnews.com/2025-01-20-progressive-worldviews-based-upon-collection-of-myths.html,https://www.naturalnews.com/wp-content/uploads/sites/91/2025/01/lies.png,2025-01-20T06:00:00Z,Michael Huemers Progressive Myths is a powerful critique of contemporary progressive dogmas that eviscerates popular cliches with clinical precision. The University of Colorado philosophy professor p… [+11699 chars]
BusinessLine,Shabana  Mitra & Shravani Prakash,What do women want from the Budget?,More funds must be allocated to schemes that address women’s unpaid domestic work,https://www.thehindubusinessline.com/opinion/what-do-women-want-from-the-budget/article69150326.ece,https://bl-i.thgim.com/public/incoming/d2zspw/article69150428.ece/alternates/LANDSCAPE_1200/_KMK1048.jpg,2025-01-28T15:45:26Z,"The 2024 Budget marked a significant milestone by allocating the highest-ever amount to the gender budget, accounting for 6.8 per cent of the total Budget or 1 per cent of GDP. 
While this is a step… [+6574 chars]"
Livemint,Dakshita Ojha,Best business loan schemes for women in India: Top 5 options to consider,"The rise of women-led firms in India reflects their contribution to economic growth. Government schemes like Mudra Yojana and Stand-Up India support women entrepreneurs through financial aid and training, empowering them to overcome challenges and contribute …",https://www.livemint.com/money/personal-finance/best-business-loan-schemes-for-women-in-india-top-5-options-to-consider-11736400855228.html,https://www.livemint.com/lm-img/img/2025/01/09/1600x900/rupixen-_rupee-unsplash_1732857225222_1736401056801.jpg,2025-01-09T11:27:15Z,"In India, the number of women-led firms has risen sharply in recent years, reflecting the impressive contribution of women to economic progress. The government has introduced various financial scheme… [+3993 chars]"
The Times of India,Suryash Kumar,"MSMEs get Budget push: Boosting exports, improving credit access, creating women entrepreneurs","The Union Budget 2026 has enhanced credit guarantee cover for MSMEs from Rs 5 crore to Rs 10 crore, aiming to generate Rs 1.5 lakh crore credit in five years. Micro-enterprises will receive customized credit cards with a Rs 5 lakh limit, and a fresh Rs 10,000…",https://economictimes.indiatimes.com/news/economy/policy/msmes-get-budget-push-boosting-exports-improving-credit-access-creating-women-entrepreneurs/articleshow/117821510.cms,"https://img.etimg.com/thumb/msid-117821583,width-1200,height-630,imgsize-15530,overlay-economictimes/articleshow.jpg",2025-02-01T07:15:37Z,"Artificial Intelligence(AI)
AI and Analytics based Business Strategy
By - Tanusree De, Managing Director- Accenture Technology Lead, Trustworthy AI Center of Excellence: ATCI
View Program"
Biztoc.com,aol.com,The 10 best small business grants for women (2025),"Women's business ownership is a driving force in the American economy, creating millions of jobs and generating trillions in revenue. Beyond impressive numbers, women entrepreneurs bring unique perspectives and solutions to the table, addressing gaps in indus…",https://biztoc.com/x/b8a84fcc53c3b0d9,https://biztoc.com/cdn/b8a84fcc53c3b0d9_s.webp,2025-01-02T15:28:30Z,"Women's business ownership is a driving force in the American economy, creating millions of jobs and generating trillions in revenue. Beyond impressive numbers, women entrepreneurs bring unique persp… [+149 chars]"
Nakedcapitalism.com,Yves Smith,Michael Hudson’s Introduction to Giorgio Buccellati’s At the Origins of Politics,Michael Hudson introduces anthropologist Giorgio Buccellati's fascinating book on the political evolution of earlier societies.,https://www.nakedcapitalism.com/2025/01/michael-hudsons-introduction-to-giorgio-buccellatis-at-the-origins-of-politics.html,,2025-01-04T11:00:26Z,"If you liked Michael Hudson’s introduction to Friedrich Schurtzs book, the Origins of Money, this is a companion introduction dealing more with technology and urbanization than with money. Giorgio Bu… [+21077 chars]"
BBC News,"Dan Roan, Stephan Shemilt",Mumbai Indians owners buy stake in Oval Invincibles,The owners of Indian Premier League team Mumbai Indians win the right to buy a stake in Oval Invincibles in a landmark move for English cricket.,https://www.bbc.com/sport/cricket/articles/crm7dz02emxo,https://ichef.bbci.co.uk/ace/branded_sport/1200/cpsprodpb/b867/live/1b264200-df29-11ef-9d74-4b28aaa5d38e.jpg,2025-01-30T16:48:42Z,"The owners of Indian Premier League team Mumbai Indians have won the right to buy a stake in Oval Invincibles in a landmark move for English cricket.
On Thursday the Invincibles became the first of … [+1193 chars]"
Skift,Barbara Scofidio,Planners Use Visioning to Start Off 2025,"Visioning can be a powerful tool to start the year. But it’s not enough, says Tyra Dyson, who leads a workshop for planners focused on turning visions into reality. -Barbara Scofidio",http://meetings.skift.com/2025/01/15/planners-use-visioning-to-start-off-2025/,https://meetings.skift.com/wp-content/uploads/2025/01/final-image1.jpg,2025-01-15T13:44:38Z,"Weve all seen it or done it before. People start the new year by creating a vision board with words and images that illustrate their hopes and plans.
But then they basically hang it up somewhere and… [+3275 chars]"
Forbes,"Dasha Shunina, Contributor, 
 Dasha Shunina, Contributor
 https://www.forbes.com/sites/dariashunina/",How Tech Startups Are Changing Travel For Good,"These emerging players are setting trends that will reshape how we book, experience, and connect with destinations in 2025.",https://www.forbes.com/sites/dariashunina/2025/01/31/how-tech-startups-are-changing-travel-for-good/,https://imageio.forbes.com/specials-images/imageserve/679d6eab8a951fae077a3e19/0x0.jpg?format=jpg&height=900&width=1600&fit=bounds,2025-02-01T00:49:21Z,"Young business woman working at the computer in cafe on the rock. Young girl downshifter working at ... [+] a laptop at sunset or sunrise on the top of the mountain to the sea, working day.
getty
A… [+12050 chars]"
Naturalnews.com,Willow Tohi,THE RISE OF TECHNOCRACY: How Silicon Valleyâs vision threatens the American dream,"A new form of governance led by Silicon Valley technocrats is emerging, where algorithms, AI and digital surveillance replace democracy, individual liberty and the free market. Technocrats like Elon Musk and Peter Thiel advocate for a system managed by techni…",https://www.naturalnews.com/2025-01-27-silicon-valleys-vision-threatens-the-american-dream.html,https://www.naturalnews.com/wp-content/uploads/sites/91/2025/01/Big-Tech-Wanted-Poster.jpg,2025-01-27T06:00:00Z,"<ul><li>A new form of governance led by Silicon Valley technocrats is emerging, where algorithms, AI and digital surveillance replace democracy, individual liberty and the free market.</li><li>Techno… [+6128 chars]"
The Times of India,PTI,Telangana tops in own tax revenue during Apr-Nov last year: Economic Survey,"Telangana leads in own tax revenue at 88%, followed by Karnataka and Haryana at 86% each. Additionally, Telangana excels with 86% irrigation coverage in its cropped area. The state's WE Hub initiative has significantly supported women entrepreneurs, raising R…",https://economictimes.indiatimes.com/industry/banking/finance/telangana-tops-in-own-tax-revenue-during-apr-nov-last-year-economic-survey/articleshow/117787603.cms,"https://img.etimg.com/thumb/msid-117787733,width-1200,height-630,imgsize-90628,overlay-economictimes/articleshow.jpg",2025-01-31T10:39:28Z,"Telangana is the frontrunner with 88 per cent in own tax revenue (OTR) between April - November last year followed by Karnataka and Haryana at 86 per cent each, Economic Survey 2024-25 said on Friday… [+1053 chars]"
The Punch,Daniel Adaji,Nigeria secures $183m agric intervention for 3.1 million beneficiaries,"Not less than three million household members across 456,000 smallholder farmers and rural entrepreneurs in Northern Nigeria are set to benefit from the International Fund for Agricultural Development and the Federal Government of Nigeria’s Value Chain Develo…",https://punchng.com/nigeria-secures-183m-agric-intervention-for-3-1-million-beneficiaries/,https://cdn.punchng.com/wp-content/uploads/2023/10/27023019/Farmers.jpg,2025-01-30T01:42:18Z,"Not less than three million household members across 456,000 smallholder farmers and rural entrepreneurs in Northern Nigeria are set to benefit from the International Fund for Agricultural Developmen… [+4833 chars]"
