Source,Author,Title,Description,URL,Image URL,Published At,Content
NPR,Stephanie Rivera,The immigration journey: How long does it take to feel like an American?,What does it take to feel like an American - and to be treated like one? Several communities shared their perspectives on the immigrant experience.,https://www.npr.org/2025/01/16/nx-s1-5252812/american-immigration-safety-entrepreneurship,https://npr.brightspotcdn.com/dims3/default/strip/false/crop/3840x2160+0+0/resize/1400/quality/100/format/jpeg/?url=http%3A%2F%2Fnpr-brightspot.s3.amazonaws.com%2Fb1%2F8e%2Fda005def4ac5a3c9630022b0ebac%2Facrossthedivide4e.jpg,2025-01-16T21:20:46Z,Fatima Sadaf Saied is a daughter of immigrants and a mother of five. She has lived in Florida her whole life. She's an executive at a nonprofit. Yet she feels that people who don't know her don't alw… [+8530 chars]
Business Insider,Sydney Bradley,"Why 'private social networks' will drive the future of social media, according to a prominent investor in the space","Alex Hofmann, CEO of 9count, is betting on ""private social networks"" being the next big thing. He was formerly an exec at Musical.ly.",https://www.businessinsider.com/private-networks-next-big-social-media-trend-2025-1,https://i.insider.com/679b9d9b196626c40985cb69?width=1200&format=jpeg,2025-01-31T09:21:02Z,"Alex Hofmann is the CEO of the social-media conglomerate 9count.Courtesy of Alex Hofmann
<ul><li>Alex Hofmann founded 9count, a social media app conglomerate, in 2019 after leaving Musical.ly.</li><… [+4433 chars]"
Forbes,"Megan Bruneau, Contributor, 
 Megan Bruneau, Contributor
 https://www.forbes.com/sites/meganbruneau/people/meganbruneau/",8 Women Entrepreneurs On Building Businesses Alongside Mental Health Diagnoses,"There are costs to entrepreneurial independence: high pressure, relentless uncertainty, and the constant weight of having your livelihood rest entirely on your shoulders.",https://www.forbes.com/sites/meganbruneau/2025/01/30/the-hidden-struggles-entrepreneurs-with-mental-health-diagnoses/,"https://imageio.forbes.com/specials-images/imageserve/679184ab676c4c5849202b5b/0x0.jpg?format=jpg&crop=1920,1080,x0,y0,safe&height=900&width=1600&fit=bounds",2025-01-30T22:28:44Z,"Clockwise from top left: Jes Osrow, Emily Reza, Amanda Hofman, Natalie Nicole, Ashley Rector, Lexi ... [+] Hartmann St. Laurent, Danielle Thompson, and Stephanie Long.
YAUHENIYA PIRAHOVA
In my five… [+9914 chars]"
Forbes,"Megan Bruneau, Contributor, 
 Megan Bruneau, Contributor
 https://www.forbes.com/sites/meganbruneau/people/meganbruneau/",Why 6 Women Chose Entrepreneurship To Save Their Mental Health,"Flexibility and autonomy, plus the chance to align work with strengths and passions, provide a sense of agency and freedom for entrepreneurs with mental health challenges.",https://www.forbes.com/sites/meganbruneau/2025/01/27/why-6-women-chose-entrepreneurship-to-save-their-mental-health/,https://imageio.forbes.com/specials-images/imageserve/679183ac14756cf79cf99316/0x0.jpg?format=jpg&height=900&width=1600&fit=bounds,2025-01-27T22:59:34Z,"Clockwise from top left: Caroline Crawford, Vanessa Farino, Olivia Hipkins, Ariana Rodriguez, Grace ... [+] Nguyen, and Catalina Parker.
YAUHENIYA PIRAHOVA
In my five-part series on mental health a… [+7760 chars]"
Forbes,"Trevor Clawson, Contributor, 
 Trevor Clawson, Contributor
 https://www.forbes.com/sites/trevorclawson/",Female Social Entrepreneurs Face Age Barriers,"The mid to late thirties period is a prime time for starting a business, but as new research on social entrepreneurship finds, it's a tough age for female founders.",https://www.forbes.com/sites/trevorclawson/2025/01/19/female-social-entrepreneurs-face-age-barriers/,https://imageio.forbes.com/specials-images/imageserve/678a7b8b672acad9fcda0fd5/0x0.jpg?format=jpg&height=900&width=1600&fit=bounds,2025-01-19T07:56:41Z,"Professor Ute Stephan says social entrepreneurship has proved attractive to women
Nathan Clarke 
nathan@nathanclarkephotography.co.uk
www.nathanclarkephotography.co.uk
www.nathanclarkephotography… [+4768 chars]"
Forbes,"Maggie McGrath, Forbes Staff, 
 Maggie McGrath, Forbes Staff
 https://www.forbes.com/sites/maggiemcgrath/",How Women Are Penalized For ‘Masculine Energy.’ Plus: Is The Glass Cliff A Myth?,"Welcome to this week’s ForbesWomen newsletter, which every Thursday brings news about the world’s top female entrepreneurs, leaders and investors straight to your inbox.",https://www.forbes.com/sites/maggiemcgrath/2025/01/17/how-women-are-penalized-for-masculine-energy-plus-is-the-glass-cliff-a-myth/,"https://imageio.forbes.com/specials-images/imageserve/678ad96f523305c0a228be52/0x0.jpg?format=jpg&crop=3599,2024,x0,y563,safe&height=900&width=1600&fit=bounds",2025-01-17T22:30:04Z,"This is this weeks ForbesWomen newsletter, which every Thursday brings news about the worlds top female entrepreneurs, leaders and investors straight to your inbox. Click here to get on the newslette… [+5469 chars]"
Forbes,"Elaine Pofeldt, Senior Contributor, 
 Elaine Pofeldt, Senior Contributor
 https://www.forbes.com/sites/elainepofeldt/",Women Around The Globe Are Now Running High-Growth Startups In Record Numbers,"Women now make up the majority of entrepreneurs bringing innovations to market in Chile, Colombia, Iran, Lithuania, the Netherlands and Venezuela, according to the Global Entrepreneurship Monitor—and are launching startups in greater numbers.",https://www.forbes.com/sites/elainepofeldt/2025/01/31/women-around-the-globe-are-now-running-high-growth-startups-in-record-numbers/,https://imageio.forbes.com/specials-images/imageserve/679cd1fe6ec8fcbb6cbe4bac/0x0.jpg?format=jpg&height=900&width=1600&fit=bounds,2025-01-31T13:42:23Z,"Ariana Martín is determined to help cities harness their own wind energy through Roseo Eólica Urbana
, a startup she co-founded in northern Spain.
Komali Dadlani is working on turning smartphones i… [+7463 chars]"
Forbes,"Holly Eve, Contributor, 
 Holly Eve, Contributor
 https://www.forbes.com/sites/hollyeve/",From Grants To Loans: A Funding Roadmap For Female Business Owners,"Explore mission-based lenders, grant opportunities, and Cherub, a platform connecting women-owned businesses with angel investors.",https://www.forbes.com/sites/hollyeve/2025/01/23/from-grants-to-loans-a-funding-roadmap-for-female-business-owners/,https://imageio.forbes.com/specials-images/imageserve/6790b09a6c1a9d916a3c10f3/0x0.jpg?format=jpg&height=900&width=1600&fit=bounds,2025-01-23T21:27:44Z,"Getty
getty
Access to capital often determines whether a business scales successfully or shutters. It dictates whether a founder can transform their idea into a thriving small business, achieve gro… [+5598 chars]"
Forbes,"Maggie McGrath, Forbes Staff, 
 Maggie McGrath, Forbes Staff
 https://www.forbes.com/sites/maggiemcgrath/",How Wandia Gichuru Is Building East Africa’s Largest Fashion Brand. Plus: 10 Ways To Master The Art Of Letting Go,"Welcome to this week’s ForbesWomen newsletter, which every Thursday brings news about the world’s top female entrepreneurs, leaders and investors straight to your inbox.",https://www.forbes.com/sites/maggiemcgrath/2025/01/31/how-wandia-gichuru-is-building-east-africas-largest-fashion-brand-plus-10-ways-to-master-the-art-of-letting-go/,"https://imageio.forbes.com/specials-images/imageserve/679d50085c917e9ca369c128/0x0.jpg?format=jpg&crop=1080,810,x0,y30,safe&height=900&width=1600&fit=bounds",2025-01-31T22:38:42Z,"This is this weeks ForbesWomen newsletter, which every Thursday brings news about the worlds top female entrepreneurs, leaders and investors straight to your inbox. Click here to get on the newslette… [+6211 chars]"
Al Jazeera English,Al Jazeera Staff,Who are the Palestinian prisoners released by Israel?,"Palestinians are celebrating the release of 90 prisoners, including 69 women, most of whom were held without charges.",https://www.aljazeera.com/news/2025/1/20/who-are-the-palestinian-prisoners-released-by-israel,https://www.aljazeera.com/wp-content/uploads/2025/01/AFP__20250120__36UR467__v3__HighRes__TopshotPalestinianIsraelConflictCeasefirePrison-1737372966.jpg?resize=1920%2C1440,2025-01-20T16:08:30Z,"The Israeli-occupied West Bank has erupted in celebrations after 90 Palestinian prisoners, most of them women, were released from Israeli jails as part of an Israel-Hamas ceasefire.
Families in the … [+6604 chars]"
Forbes,"Melissa Houston, Contributor, 
 Melissa Houston, Contributor
 https://www.forbes.com/sites/melissahouston/",How Women Over 50 Are Redefining Success Through Entrepreneurship,That’s why we see a powerful shift happening in the world of entrepreneurship by an unexpected demographic: women over 50.,https://www.forbes.com/sites/melissahouston/2025/01/29/how-women-over-50-are-redefining-success-through-entrepreneurship/,"https://imageio.forbes.com/specials-images/imageserve/679797baee06e64e6786f830/0x0.jpg?format=jpg&crop=1618,1214,x101,y0,safe&height=900&width=1600&fit=bounds",2025-01-29T11:00:00Z,"How Women Over 50 Are Redefining Success Through Entrepreneurship
getty
For women over 50, success isnt solely about climbing corporate ladders or chasing traditional definitions of wealth. Its abo… [+3501 chars]"
Forbes,"Dax Grant, Forbes Councils Member, 
 Dax Grant, Forbes Councils Member
 https://www.forbes.com/councils/forbestechcouncil/people/daxgrant/",Mobile Optimization: Why Entrepreneurs Have Increased Focus On Mobile Experiences,Mobile optimization is no longer optional but essential for maintaining a competitive advantage.,https://www.forbes.com/councils/forbestechcouncil/2025/01/14/mobile-optimization-why-entrepreneurs-have-increased-focus-on-mobile-experiences/,https://imageio.forbes.com/specials-images/imageserve/67856234d8516ceca8030cc5/0x0.jpg?format=jpg&height=900&width=1600&fit=bounds,2025-01-14T13:00:00Z,"Dax Grant is the CEO of Global Transform and an authority on C-suite leadership. Global 100 CIO, 100 Women to Watch, CREA Global Award List.
getty
As an entrepreneur in today's fast-paced digital w… [+6294 chars]"
Forbes,"Andrew DeAngelo, Contributor, 
 Andrew DeAngelo, Contributor
 https://www.forbes.com/sites/andrewdeangelo/",France Gives Medical Cannabis A Tentative ‘Oui’,"The first medical marijuana conference in Bordeaux, France, featuring doctors, scientists, and entrepreneurs from the UK and Europe.",https://www.forbes.com/sites/andrewdeangelo/2025/01/28/france-gives-medical-cannabis-a-tentative-oui/,"https://imageio.forbes.com/specials-images/imageserve/67981969659bd13d0961452a/0x0.jpg?format=jpg&crop=4777,2848,x323,y552,safe&height=900&width=1600&fit=bounds",2025-01-28T17:52:45Z,"Therapeutic cannabis is currently in a trial phase in France. (Photo by: BSIP/Universal Images Group ... [+] via Getty Images)
Universal Images Group via Getty Images
France is an exceptional place… [+8913 chars]"
Forbes,"Melissa Houston, Contributor, 
 Melissa Houston, Contributor
 https://www.forbes.com/sites/melissahouston/",Imposter Syndrome And Success: How Millionaires Battle Self-Doubt,"It’s easy to assume that wealth and success bring unshakable confidence, but many high achievers battle the same self-doubt that plagues entrepreneurs: imposter syndrome.",https://www.forbes.com/sites/melissahouston/2025/01/26/imposter-syndrome-and-success-how-millionaires-battle-self-doubt/,"https://imageio.forbes.com/specials-images/imageserve/67951784f3686e5a48248f58/0x0.jpg?format=jpg&crop=2686,2012,x165,y0,safe&height=900&width=1600&fit=bounds",2025-01-26T11:00:00Z,"Imposter Syndrome And Success: How Millionaires Battle Self-Doubt
getty
Have you ever looked at a millionaire or a successful entrepreneur and assumed that they must have it all figured out? Its ea… [+4250 chars]"
Forbes,"Elena Volotovskaya, Forbes Councils Member, 
 Elena Volotovskaya, Forbes Councils Member
 https://www.forbes.com/councils/forbesfinancecouncil/people/elenavolotovskaya/",Investing In Women: A Strategic Imperative For Diverse And Profitable Venture Capital,Lack of representation significantly impacts innovation and overall performance within the sector.,https://www.forbes.com/councils/forbesfinancecouncil/2025/01/16/investing-in-women-a-strategic-imperative-for-diverse-and-profitable-venture-capital/,https://imageio.forbes.com/specials-images/imageserve/602ed07bf39c199333d7dcd3/0x0.jpg?format=jpg&height=900&width=1600&fit=bounds,2025-01-16T13:00:00Z,"Elena Volotovskaya is the Head of Softline Venture Partners.
getty
Diversity in venture capital (VC) has emerged as a pressing issue, with the industry facing a stark underrepresentation of women a… [+7044 chars]"
Deadline,Armando Tinoco,‘Real Housewives’ Star Nene Leakes & ‘Love & Hip Hop: Atlanta’ Star Sierra Glamshop To Co-Host ‘Me & My Homegirl’ Podcast,EXCLUSIVE: The Real Housewives of Atlanta alum Nene Leakes and Love & Hip Hop: Atlanta star Sierra Glamshop are set to co-host the Me & My Homegirl podcast. The reality stars and entrepreneurs will offer their podcast listeners a candid and unfiltered take on…,http://deadline.com/2025/01/real-housewives-nene-leakes-love-and-hip-hop-atlanta-sierra-glamshop-me-and-my-homegirl-podcast-1236252423/,https://deadline.com/wp-content/uploads/2025/01/nene-leakes-sierra-gates-me-and-my-homegirl-podcast.jpg?w=1024,2025-01-09T15:00:00Z,"EXCLUSIVE: The Real Housewives of Atlanta alum Nene Leakes and Love &amp; Hip Hop: Atlanta star Sierra Glamshop are set to co-host the Me &amp; My Homegirl podcast.
The reality stars and entrepreneu… [+2290 chars]"
Fsfe.org,,FOSDEM and DMA updates and 2025 YH4F and Our visions for 2048,"The new year has begun, offering 365 days to promote Free Software! As we prepare for FOSDEM and continue working on the DMA implementation, we are excited...",https://fsfe.org/news/nl/nl-202501.en.html,https://pics.fsfe.org/uploads/original/82/9c/2e418e502e5c07e3abaaa3a5bbbf.png,2025-01-14T13:23:49Z,"Newsletter
The new year has begun, offering 365 days to promote Free Software! As we prepare
for FOSDEM and continue working on the DMA implementation, we are excited 
to launch the fourth edition… [+8482 chars]"
Forbes,"Sughnen Yongo, Contributor, 
 Sughnen Yongo, Contributor
 https://www.forbes.com/sites/sughnenyongo/",5 Policy Changes Under Trump That Will Impact Black Women,Policies implemented during Donald Trump’s former presidency and the potential for their return with his re-election will have implications for the o...,https://www.forbes.com/sites/sughnenyongo/2025/01/23/5-policy-changes-under-trump-that-will-impact-black-women/,https://imageio.forbes.com/specials-images/imageserve/67910a39bc6d8681bdfe1f46/0x0.jpg?format=jpg&height=900&width=1600&fit=bounds,2025-01-23T12:30:08Z,"Black women working together in a business setting. 
getty
Black women have long been a focal demographic at the intersection of economic, social and political changes in the United States. In this… [+3562 chars]"
Forbes,"Elizabeth MacBride, Senior Contributor, 
 Elizabeth MacBride, Senior Contributor
 https://www.forbes.com/sites/elizabethmacbride/",‘Hardship Makes You Brave’: Afghan Women In Arkansas Aim For Entrepreneurship,Ahmadzai wants to introduce more people to the flavors of her country. She’s perfecting a chutney she plans to sell as part of a Cottage Industries program in Arkansas.,https://www.forbes.com/sites/elizabethmacbride/2025/01/24/hardship-makes-you-brave-afghan-women-in-arkansas-aim-for-entrepreneurship/,https://imageio.forbes.com/specials-images/imageserve/6793f9f8a54ac793f8ed1a5c/0x0.jpg?format=jpg&height=900&width=1600&fit=bounds,2025-01-24T21:01:17Z,"An Afghan woman graduates from the cottage industry program at Canopy, which provides refugee ... [+] services in Northwest Arkansas.
Canopy
Khalida Ahmadzai learned to make jalapeno chutney from h… [+7355 chars]"
Forbes,"Zoya Hasan, Forbes Staff, 
 Zoya Hasan, Forbes Staff
 https://www.forbes.com/sites/zoyahasan/","As Wildfires Rage, These Under 30s Turned Their Businesses Into Lifelines","Palisades residents Mary Ralph Lawson Bradley and Kennedy Crichlow lost everything in the Los Angeles wildfires—yet, they're amongst the Under 30 entrepreneurs that are helping victims recover.",https://www.forbes.com/sites/zoyahasan/2025/01/17/as-wildfires-rage-these-under-30s-turned-their-businesses-into-lifelines/,https://imageio.forbes.com/specials-images/imageserve/6789829d8c566d0c530d53ad/0x0.jpg?format=jpg&height=900&width=1600&fit=bounds,2025-01-17T13:00:00Z,"Think this is nice? Its a version of the weekly Under 30 newsletter and would be even better in your inbox. 
Kennedy Crichlow (left) and Mary Ralph Lawson Bradley (right).
Courtesy of Daily Drills… [+6504 chars]"
Forbes,"Amanda Miller Littlejohn, Contributor, 
 Amanda Miller Littlejohn, Contributor
 https://www.forbes.com/sites/amandamillerlittlejohn/",7 Podcasts To Help You Earn More And Work Smarter Without Burnout,7 must-listen podcasts hosted by women. These podcasts will help you approach ambition in a sustainable way so you have more time for what matters most to you in 2025.,https://www.forbes.com/sites/amandamillerlittlejohn/2025/01/09/7-podcasts-to-help-you-earn-more-and-work-smarter-without-burnout/,https://imageio.forbes.com/specials-images/imageserve/677feceb935785181443e700/0x0.jpg?format=jpg&height=900&width=1600&fit=bounds,2025-01-09T16:06:12Z,"Smiling and successful young woman recording podcast on interview in studio using equipments like ... [+] microphone, laptop and headphones
getty
If you're a midlife professional looking to redefin… [+5949 chars]"
Forbes,"Kevin Rozario, Contributor, 
 Kevin Rozario, Contributor
 https://www.forbes.com/sites/kevinrozario/",Trump’s Attack On The FAA’s DEI Efforts Will Impact Airport Retailing,"American airports, concessionaires, and the FAA are still reeling from the speed at which DEI initiatives might come to an end.",https://www.forbes.com/sites/kevinrozario/2025/02/01/trumps-attack-on-the-faas-dei-efforts-will-impact-airport-retailing/,"https://imageio.forbes.com/specials-images/imageserve/679dbd590e69c5a7e27cdcc4/0x0.jpg?format=jpg&crop=1200,675,x0,y40,safe&height=900&width=1600&fit=bounds",2025-02-01T06:51:13Z,"Dr Lord-Marcelle's Mother Earth juice bar is one of six new retail spaces at JFK Airport's Terminal ... [+] 8 run by local, women- and minority-owned entrepreneurs.
Unibail-Rodamco-Westfield
Donald… [+5364 chars]"
Al Jazeera English,Shola Lawal,Why has Ivory Coast’s national dish attieke become a global icon?,UN cultural agency UNESCO recognises the fermented cassava meal that takes days to prepare as a living heritage object.,https://www.aljazeera.com/features/2025/1/5/why-has-ivory-coasts-national-dish-attieke-become-a-global-icon,https://www.aljazeera.com/wp-content/uploads/2025/01/AFP__20150307__Par8114552__v2__HighRes__IcoastTraditionFeature-1735735510_f32e43-1735740037.jpg?resize=1200%2C630&quality=80,2025-01-05T08:25:43Z,"Rumour has it that some Ivorians can eat attieke morning, afternoon and night.
The fermented cassava meal has long been a marker of national identity in Ivory Coast, beloved across all levels of soc… [+7522 chars]"
Mindful.org,Georgina Miranda,A Guided Meditation to Reset and Let Go,"In this guided mindfulness practice, we release what no longer serves us and anchor in our inner wisdom, peace, and freedom.
The post A Guided Meditation to Reset and Let Go appeared first on Mindful.",https://www.mindful.org/a-guided-meditation-to-reset-and-let-go/,https://www.mindful.org/content/uploads/12MM_Georgina-Miranda_Reset-and-Let-Go.jpeg,2025-01-09T08:47:00Z,"Georgina is a global leader in change, transformation, mindfulness, conscious leadership development and the advancement of women. She is also a mountaineer athlete and activist igniting inspired act… [+642 chars]"
Forbes,"AllBusiness, Contributor, 
 AllBusiness, Contributor
 https://www.forbes.com/sites/allbusiness/people/AllBusiness/",7 Leaders Predict Small Business Trends For 2025,We've tapped into the expertise of seasoned small business leaders to learn about the biggest trends of 2025 as well as actionable insights for the coming year.,https://www.forbes.com/sites/allbusiness/2025/01/06/7-leaders-predict-small-business-trends-for-2025/,"https://imageio.forbes.com/specials-images/imageserve/673d26cd15b646f1569fac36/0x0.jpg?format=jpg&crop=2025,1139,x93,y0,safe&height=900&width=1600&fit=bounds",2025-01-06T17:41:09Z,"By Rieva Lesonsky
The momentum of female entrepreneurship is expected to accelerate in 2025.
getty
With innovative ways to build businesses, more strategies for offering hyper-personalized custome… [+12254 chars]"
Forbes,"Cheryl Robinson, Contributor, 
 Cheryl Robinson, Contributor
 https://www.forbes.com/sites/cherylrobinson/people/cherylrobinson5/",Chief’s Executive Transition Teaches Leaders How To Step Forward By Stepping Aside,"Carolyn Childers, Chief cofounder and current CEO, and Lindsay Kaplan, cofounder and CBO, are transitioning to board positions. Alison Moore to become CEO of Chief.",https://www.forbes.com/sites/cherylrobinson/2025/01/15/chiefs-executive-transition-teaches-leaders-how-to-step-forward-by-stepping-aside/,"https://imageio.forbes.com/specials-images/imageserve/6787a81d3cfad63e64136b16/0x0.jpg?format=jpg&crop=2370,1333,x0,y0,safe&height=900&width=1600&fit=bounds",2025-01-15T15:00:00Z,"Caption: Chief's new CEO Alison Moore (center) with cofounder Lindsay Kaplan (left) and former CEO ... [+] and cofounder Carolyn Childers (right).
Johannes Oberman
Carolyn Childers and Lindsay Kapl… [+7375 chars]"
Forbes,"Gemma Allen, Contributor, 
 Gemma Allen, Contributor
 https://www.forbes.com/sites/gemmaallen/",TikTok Crisis 2025: Legacy Impact On Female Business And GenZ,TikTok's temporary blackout reveals its complex role: a catalyst for female entrepreneurship yet a double-edged sword reshaping women's identity and mental health,https://www.forbes.com/sites/gemmaallen/2025/01/29/tiktok-crisis-2025-legacy-impact-on-female-business-and-genz/,https://imageio.forbes.com/specials-images/imageserve/679941dac261c9b9a2dc1546/0x0.jpg?format=jpg&height=900&width=1600&fit=bounds,2025-01-30T02:30:37Z,"WASHINGTON, DC - JANUARY 10: (L-R) Sarah Baus of Charleston, S.C., holds a sign that reads ""Keep ... [+] TikTok"" as she and other content creators Sallye Miley of Jackson, Mississippi, and Callie Goo… [+6751 chars]"
Thedailymash.co.uk,The Daily Mash,When will cowardly Starmer follow Trump’s example and pardon our selfless drug dealers?,THEY work all hours. They’re entrepreneurs. And nothing matters more to them than putting a smile on their customers’ faces. So why are they locked up?,https://www.thedailymash.co.uk/politics/when-will-cowardly-starmer-follow-trumps-example-and-pardon-our-selfless-drug-dealers-20250122254175,https://cdn.thedailymash.co.uk/wp-content/uploads/20250122125939/locked-up-667x375-1.jpg,2025-01-22T13:03:06Z,"By Abigail Pennson, our reasonable, plain-speaking middle-class columnist who loves Britain so much she wishes it was America
THEY work all hours. Theyre entrepreneurs. And nothing matters more to t… [+1514 chars]"
TechRadar,Craig Hale,Microsoft reveals billion-dollar cloud and AI investment plan in India,Satya Nadella confirms $3 billion Microsoft investment to help equip India with artificial intelligence skills.,https://www.techradar.com/pro/microsoft-reveals-billion-dollar-cloud-and-ai-investment-plan-in-india,https://cdn.mos.cms.futurecdn.net/4xXbwrU8iJGtbjCNHwgmcm-1200-80.jpg,2025-01-08T12:00:00Z,<ul><li>India set to receive $3 billion from Microsoft over the next two years</li><li>The company wants to upskill 10 million citizens by 2030</li><li>Further workshops and opportunities will suppor… [+2278 chars]
Hubspot.com,hello@kaylalewkowicz.com (Kayla Voigt),How to Find Investors: A Guide for Entrepreneurs,The dominant narrative of business growth focuses on unicorn startups helmed by eccentric but brilliant Silicon Valley technocrats that venture capital firms pour money into. The true reality is that most startups and small businesses rely on personal savings…,https://blog.hubspot.com/sales/find-investors#article,https://www.hubspot.com/hubfs/how-to-find-investors.webp,2025-01-28T12:00:00Z,The dominant narrative of business growth focuses on unicorn startups helmed by eccentric but brilliant Silicon Valley technocrats that venture capital firms pour money into. The true reality is that… [+17391 chars]
Skift,Rashaad Jorden,"Hotel CEOs’ Diversity Embrace, D.C.’s Crash Investigation and Japan's Indian Tourist Boom","On today’s podcast we discuss hotel CEOs and their business-first embrace of diversity, the ongoing airline crash investigation in Washington, D.C., and an Indian tourist boom in Japan. -Rashaad Jorden",http://skift.com/2025/01/31/hotel-ceos-diversity-embrace-d-c-s-crash-investigation-and-japans-indian-tourist-boom/,https://skift.com/wp-content/uploads/2025/01/AdobeStock_320089338.jpeg,2025-01-31T12:20:30Z,"Good morning from Skift. Its Friday, January 31, and heres what you need to know about the business of travel today.
With diversity initiatives under threat by the Trump Administration, CEOs of larg… [+1839 chars]"
